{
  "name": "Hubhopper Partner Integration API(s) - Production",
  "description": "This is an interactive document explaining the API(s) that could be used to fetch data from [Hubhopper](https://hubhopper.com). Use the api key provided to authorize `x-api-key` and test the API(s). The output data models are also available for reference.",
  "categories": [
    "entertainment"
  ],
  "logo": null,
  "openApiJsonUrl": "https://api.apis.guru/v2/specs/hubhopper.com/v5/swagger.json",
  "openApiYamlUrl": "https://api.apis.guru/v2/specs/hubhopper.com/v5/swagger.yaml",
  "openApiVersion": "2.0",
  "externalDocsUrl": null,
  "source": "apis.guru"
}