{
  "name": "Amazon Rekognition",
  "description": "This is the API Reference for [Amazon Rekognition Image](https://docs.aws.amazon.com/rekognition/latest/dg/images.html), [Amazon Rekognition Custom Labels](https://docs.aws.amazon.com/rekognition/latest/customlabels-dg/what-is.html), [Amazon Rekognition Stored Video](https://docs.aws.amazon.com/rekognition/latest/dg/video.html), [Amazon Rekognition Streaming Video](https://docs.aws.amazon.com/rekognition/latest/dg/streaming-video.html). It provides descriptions of actions, data types, common parameters, and common errors.\n\n**Amazon Rekognition Image**\n\n\n-  [CompareFaces](https://docs.aws.amazon.com/rekognition/latest/APIReference/API_CompareFaces.html)\n-  [CreateCollection](https://docs.aws.amazon.com/rekognition/latest/APIReference/API_CreateCollection.html)\n-  [DeleteCollection](https://docs.aws.amazon.com/rekognition/latest/APIReference/API_DeleteCollection.html)\n-  [DeleteFaces](https://docs.aws.amazon.com/rekognition/latest/APIReference/API_DeleteFaces.html)\n-  [DescribeCollection](https://docs.aws.amazon.com/rekognition/latest/APIReference/API_DescribeCollection.html)\n-  [DetectFaces](https://docs.aws.amazon.com/rekognition/latest/APIReference/API_DetectFaces.html)\n-  [DetectLabels](https://docs.aws.amazon.com/rekognition/latest/APIReference/API_DetectLabels.html)\n-  [DetectModerationLabels](https://docs.aws.amazon.com/rekognition/latest/APIReference/API_DetectModerationLabels.html)\n-  [DetectProtectiveEquipment](https://docs.aws.amazon.com/rekognition/latest/APIReference/API_DetectProtectiveEquipment.html)\n-  [DetectText](https://docs.aws.amazon.com/rekognition/latest/APIReference/API_DetectText.html)\n-  [GetCelebrityInfo](https://docs.aws.amazon.com/rekognition/latest/APIReference/API_GetCelebrityInfo.html)\n-  [IndexFaces](https://docs.aws.amazon.com/rekognition/latest/APIReference/API_IndexFaces.html)\n-  [ListCollections](https://docs.aws.amazon.com/rekognition/latest/APIReference/API_ListCollections.html)\n-  [ListFaces](https://docs.aws.amazon.com/rekognition/latest/APIReference/API_ListFaces.html)\n-  [RecognizeCelebrities](https://docs.aws.amazon.com/rekognition/latest/APIReference/API_RecognizeCelebrities.html)\n-  [SearchFaces](https://docs.aws.amazon.com/rekognition/latest/APIReference/API_SearchFaces.html)\n-  [SearchFacesByImage](https://docs.aws.amazon.com/rekognition/latest/APIReference/API_SearchFacesByImage.html)    **Amazon Rekognition Custom Labels**\n\n\n-  [CopyProjectVersion](https://docs.aws.amazon.com/rekognition/latest/APIReference/API_CopyProjectVersion.html)\n-  [CreateDataset](https://docs.aws.amazon.com/rekognition/latest/APIReference/API_CreateDataset.html)\n-  [CreateProject](https://docs.aws.amazon.com/rekognition/latest/APIReference/API_CreateProject.html)\n-  [CreateProjectVersion](https://docs.aws.amazon.com/rekognition/latest/APIReference/API_CreateProjectVersion.html)\n-  [DeleteDataset](https://docs.aws.amazon.com/rekognition/latest/APIReference/API_DeleteDataset.html)\n-  [DeleteProject](https://docs.aws.amazon.com/rekognition/latest/APIReference/API_DeleteProject.html)\n-  [DeleteProjectPolicy](https://docs.aws.amazon.com/rekognition/latest/APIReference/API_DeleteProjectPolicy.html)\n-  [DeleteProjectVersion](https://docs.aws.amazon.com/rekognition/latest/APIReference/API_DeleteProjectVersion.html)\n-  [DescribeDataset](https://docs.aws.amazon.com/rekognition/latest/APIReference/API_DescribeDataset.html)\n-  [DescribeProjects](https://docs.aws.amazon.com/rekognition/latest/APIReference/API_DescribeProjects.html)\n-  [DescribeProjectVersions](https://docs.aws.amazon.com/rekognition/latest/APIReference/API_DescribeProjectVersions.html)\n-  [DetectCustomLabels](https://docs.aws.amazon.com/rekognition/latest/APIReference/API_DetectCustomLabels.html)\n-  [DistributeDatasetEntries](https://docs.aws.amazon.com/rekognition/latest/APIReference/API_DistributeDatasetEntries.html)\n-  [ListDatasetEntries](https://docs.aws.amazon.com/rekognition/latest/APIReference/API_ListDatasetEntries.html)\n-  [ListDatasetLabels](https://docs.aws.amazon.com/rekognition/latest/APIReference/API_ListDatasetLabels.html)\n-  [ListProjectPolicies](https://docs.aws.amazon.com/rekognition/latest/APIReference/API_ListProjectPolicies.html)\n-  [PutProjectPolicy](https://docs.aws.amazon.com/rekognition/latest/APIReference/API_PutProjectPolicy.html)\n-  [StartProjectVersion](https://docs.aws.amazon.com/rekognition/latest/APIReference/API_StartProjectVersion.html)\n-  [StopProjectVersion](https://docs.aws.amazon.com/rekognition/latest/APIReference/API_StopProjectVersion.html)\n-  [UpdateDatasetEntries](https://docs.aws.amazon.com/rekognition/latest/APIReference/API_UpdateDatasetEntries.html)    **Amazon Rekognition Video Stored Video**\n\n\n-  [GetCelebrityRecognition](https://docs.aws.amazon.com/rekognition/latest/APIReference/API_GetCelebrityRecognition.html)\n-  [GetContentModeration](https://docs.aws.amazon.com/rekognition/latest/APIReference/API_GetContentModeration.html)\n-  [GetFaceDetection](https://docs.aws.amazon.com/rekognition/latest/APIReference/API_GetFaceDetection.html)\n-  [GetFaceSearch](https://docs.aws.amazon.com/rekognition/latest/APIReference/API_GetFaceSearch.html)\n-  [GetLabelDetection](https://docs.aws.amazon.com/rekognition/latest/APIReference/API_GetLabelDetection.html)\n-  [GetPersonTracking](https://docs.aws.amazon.com/rekognition/latest/APIReference/API_GetPersonTracking.html)\n-  [GetSegmentDetection](https://docs.aws.amazon.com/rekognition/latest/APIReference/API_GetSegmentDetection.html)\n-  [GetTextDetection](https://docs.aws.amazon.com/rekognition/latest/APIReference/API_GetTextDetection.html)\n-  [StartCelebrityRecognition](https://docs.aws.amazon.com/rekognition/latest/APIReference/API_StartCelebrityRecognition.html)\n-  [StartContentModeration](https://docs.aws.amazon.com/rekognition/latest/APIReference/API_StartContentModeration.html)\n-  [StartFaceDetection](https://docs.aws.amazon.com/rekognition/latest/APIReference/API_StartFaceDetection.html)\n-  [StartFaceSearch](https://docs.aws.amazon.com/rekognition/latest/APIReference/API_StartFaceSearch.html)\n-  [StartLabelDetection](https://docs.aws.amazon.com/rekognition/latest/APIReference/API_StartLabelDetection.html)\n-  [StartPersonTracking](https://docs.aws.amazon.com/rekognition/latest/APIReference/API_StartPersonTracking.html)\n-  [StartSegmentDetection](https://docs.aws.amazon.com/rekognition/latest/APIReference/API_StartSegmentDetection.html)\n-  [StartTextDetection](https://docs.aws.amazon.com/rekognition/latest/APIReference/API_StartTextDetection.html)    **Amazon Rekognition Video Streaming Video**\n\n\n-  [CreateStreamProcessor](https://docs.aws.amazon.com/rekognition/latest/APIReference/API_CreateStreamProcessor.html)\n-  [DeleteStreamProcessor](https://docs.aws.amazon.com/rekognition/latest/APIReference/API_DeleteStreamProcessor.html)\n-  [DescribeStreamProcessor](https://docs.aws.amazon.com/rekognition/latest/APIReference/API_DescribeStreamProcessor.html)\n-  [ListStreamProcessors](https://docs.aws.amazon.com/rekognition/latest/APIReference/API_ListStreamProcessors.html)\n-  [StartStreamProcessor](https://docs.aws.amazon.com/rekognition/latest/APIReference/API_StartStreamProcessor.html)\n-  [StopStreamProcessor](https://docs.aws.amazon.com/rekognition/latest/APIReference/API_StopStreamProcessor.html)\n-  [UpdateStreamProcessor](https://docs.aws.amazon.com/rekognition/latest/APIReference/API_UpdateStreamProcessor.html)",
  "categories": [
    "cloud"
  ],
  "logo": "logo.png",
  "openApiJsonUrl": "https://api.apis.guru/v2/specs/amazonaws.com/rekognition/2016-06-27/openapi.json",
  "openApiYamlUrl": "https://api.apis.guru/v2/specs/amazonaws.com/rekognition/2016-06-27/openapi.yaml",
  "openApiVersion": "3.0.0",
  "externalDocsUrl": "https://docs.aws.amazon.com/rekognition/",
  "source": "apis.guru"
}