{
  "name": "GitHub v3 REST API",
  "description": "GitHub's v3 REST API.",
  "categories": [
    "collaboration",
    "developer_tools"
  ],
  "logo": null,
  "openApiJsonUrl": "https://api.apis.guru/v2/specs/github.com/github.ae/1.1.4/openapi.json",
  "openApiYamlUrl": "https://api.apis.guru/v2/specs/github.com/github.ae/1.1.4/openapi.yaml",
  "openApiVersion": "3.0.3",
  "externalDocsUrl": "https://docs.github.com/github-ae@latest/rest/",
  "source": "apis.guru"
}