{
  "name": "Google Classroom API",
  "description": "Manages classes, rosters, and invitations in Google Classroom.",
  "categories": [
    "analytics",
    "media"
  ],
  "logo": "logo.png",
  "openApiJsonUrl": "https://api.apis.guru/v2/specs/googleapis.com/classroom/v1/openapi.json",
  "openApiYamlUrl": "https://api.apis.guru/v2/specs/googleapis.com/classroom/v1/openapi.yaml",
  "openApiVersion": "3.0.0",
  "externalDocsUrl": "https://developers.google.com/classroom/",
  "source": "apis.guru"
}