{
  "name": "ApiManagementClient",
  "description": "Use these REST APIs for performing operations on entities like API, Product, and Subscription associated with your Azure API Management deployment.",
  "categories": [
    "cloud"
  ],
  "logo": "logo.png",
  "openApiJsonUrl": "https://api.apis.guru/v2/specs/azure.com/apimanagement/2018-01-01/swagger.json",
  "openApiYamlUrl": "https://api.apis.guru/v2/specs/azure.com/apimanagement/2018-01-01/swagger.yaml",
  "openApiVersion": "2.0",
  "externalDocsUrl": null,
  "source": "apis.guru"
}