{
  "name": "versionhistory.googleapis.com API",
  "description": "Version History API - Prod",
  "categories": [
    "analytics",
    "media"
  ],
  "logo": null,
  "openApiJsonUrl": "https://api.apis.guru/v2/specs/googleapis.com/versionhistory/v1/openapi.json",
  "openApiYamlUrl": "https://api.apis.guru/v2/specs/googleapis.com/versionhistory/v1/openapi.yaml",
  "openApiVersion": "3.0.0",
  "externalDocsUrl": "https://developers.chrome.com/versionhistory",
  "source": "apis.guru"
}