{
  "name": "Amazon Connect Customer Profiles",
  "description": "Amazon Connect Customer Profiles Amazon Connect Customer Profiles is a unified customer profile for your contact center that has pre-built connectors powered by AppFlow that make it easy to combine customer information from third party applications, such as Salesforce (CRM), ServiceNow (ITSM), and your enterprise resource planning (ERP), with contact history from your Amazon Connect contact center. If you're new to Amazon Connect, you might find it helpful to review the [Amazon Connect Administrator Guide](https://docs.aws.amazon.com/connect/latest/adminguide/).",
  "categories": [
    "cloud"
  ],
  "logo": "logo.png",
  "openApiJsonUrl": "https://api.apis.guru/v2/specs/amazonaws.com/customer-profiles/2020-08-15/openapi.json",
  "openApiYamlUrl": "https://api.apis.guru/v2/specs/amazonaws.com/customer-profiles/2020-08-15/openapi.yaml",
  "openApiVersion": "3.0.0",
  "externalDocsUrl": "https://docs.aws.amazon.com/profile/",
  "source": "apis.guru"
}