{
  "name": "AWS IoT SiteWise",
  "description": "Welcome to the IoT SiteWise API Reference. IoT SiteWise is an Amazon Web Services service that connects [Industrial Internet of Things (IIoT)](https://en.wikipedia.org/wiki/Internet_of_things#Industrial_applications) devices to the power of the Amazon Web Services Cloud. For more information, see the [IoT SiteWise User Guide](https://docs.aws.amazon.com/iot-sitewise/latest/userguide/). For information about IoT SiteWise quotas, see [Quotas](https://docs.aws.amazon.com/iot-sitewise/latest/userguide/quotas.html) in the *IoT SiteWise User Guide*.",
  "categories": [
    "cloud"
  ],
  "logo": "logo.png",
  "openApiJsonUrl": "https://api.apis.guru/v2/specs/amazonaws.com/iotsitewise/2019-12-02/openapi.json",
  "openApiYamlUrl": "https://api.apis.guru/v2/specs/amazonaws.com/iotsitewise/2019-12-02/openapi.yaml",
  "openApiVersion": "3.0.0",
  "externalDocsUrl": "https://docs.aws.amazon.com/iotsitewise/",
  "source": "apis.guru"
}