{
  "name": "AWS Resource Groups Tagging API",
  "description": "Resource Groups Tagging API",
  "categories": [
    "cloud"
  ],
  "logo": "logo.png",
  "openApiJsonUrl": "https://api.apis.guru/v2/specs/amazonaws.com/resourcegroupstaggingapi/2017-01-26/openapi.json",
  "openApiYamlUrl": "https://api.apis.guru/v2/specs/amazonaws.com/resourcegroupstaggingapi/2017-01-26/openapi.yaml",
  "openApiVersion": "3.0.0",
  "externalDocsUrl": "https://docs.aws.amazon.com/tagging/",
  "source": "apis.guru"
}