{
  "name": "DiskResourceProviderClient",
  "description": "The Disk Resource Provider Client.",
  "categories": [
    "cloud"
  ],
  "logo": "logo.png",
  "openApiJsonUrl": "https://api.apis.guru/v2/specs/azure.com/compute-disk/2019-07-01/swagger.json",
  "openApiYamlUrl": "https://api.apis.guru/v2/specs/azure.com/compute-disk/2019-07-01/swagger.yaml",
  "openApiVersion": "2.0",
  "externalDocsUrl": null,
  "source": "apis.guru"
}