{
  "name": "Slack AI Plugin",
  "description": "A plugin that allows users to interact with Slack using ChatGPT",
  "categories": [
    "collaboration",
    "developer_tools",
    "messaging"
  ],
  "logo": "logo.png",
  "openApiJsonUrl": "https://api.apis.guru/v2/specs/slack.com/openai/v1/openapi.json",
  "openApiYamlUrl": "https://api.apis.guru/v2/specs/slack.com/openai/v1/openapi.yaml",
  "openApiVersion": "3.0.1",
  "externalDocsUrl": null,
  "source": "apis.guru"
}