{
  "name": "ApiManagementClient",
  "description": "Use these REST APIs for performing operations on logger entity Azure API Management deployment.The Logger entity in API Management represents an event sink that you can use to log API Management events. Currently the Logger entity supports logging API Management events to Azure EventHub.",
  "categories": [
    "cloud"
  ],
  "logo": "logo.png",
  "openApiJsonUrl": "https://api.apis.guru/v2/specs/azure.com/apimanagement-apimloggers/2019-12-01-preview/swagger.json",
  "openApiYamlUrl": "https://api.apis.guru/v2/specs/azure.com/apimanagement-apimloggers/2019-12-01-preview/swagger.yaml",
  "openApiVersion": "2.0",
  "externalDocsUrl": null,
  "source": "apis.guru"
}