{
  "name": "Google Tasks API",
  "description": "The Google Tasks API lets you manage your tasks and task lists.",
  "categories": [
    "analytics",
    "media"
  ],
  "logo": "logo.png",
  "openApiJsonUrl": "https://api.apis.guru/v2/specs/googleapis.com/tasks/v1/openapi.json",
  "openApiYamlUrl": "https://api.apis.guru/v2/specs/googleapis.com/tasks/v1/openapi.yaml",
  "openApiVersion": "3.0.0",
  "externalDocsUrl": "https://developers.google.com/tasks/",
  "source": "apis.guru"
}