{
  "name": "Doc Converter",
  "description": "This api converts file formats of OpenXml and OpenOffice documents formats to vector files (e.g., svg)",
  "categories": [
    "analytics"
  ],
  "logo": null,
  "openApiJsonUrl": "https://api.apis.guru/v2/specs/presalytics.io/converter/0.1/openapi.json",
  "openApiYamlUrl": "https://api.apis.guru/v2/specs/presalytics.io/converter/0.1/openapi.yaml",
  "openApiVersion": "3.0.2",
  "externalDocsUrl": null,
  "source": "apis.guru"
}