{
  "name": "Metadata API",
  "description": "The Metadata API has operations that retrieve configuration details pertaining to the different eBay marketplaces. In addition to marketplace information, the API also has operations that get information that helps sellers list items on eBay.",
  "categories": [
    "ecommerce"
  ],
  "logo": null,
  "openApiJsonUrl": "https://api.apis.guru/v2/specs/ebay.com/sell-metadata/v1.6.0/openapi.json",
  "openApiYamlUrl": "https://api.apis.guru/v2/specs/ebay.com/sell-metadata/v1.6.0/openapi.yaml",
  "openApiVersion": "3.0.0",
  "externalDocsUrl": null,
  "source": "apis.guru"
}